Détails,Prix,Adresse,Image
Appartement A Vendre,40 000 000 FCFA,Diamniadio, media/annonces/pics/thumbs/a18dcf362eb6999224af307ad195d7f4.jpg 
APPARTEMENTS F4 A VENDRE EN LOCATION VENTE,97 519 500 FCFA,Ouest Foire, media/annonces/pics/thumbs/b49aa8bc6849d3ddd100f388888d6aea.jpeg 
Appartement Meublé à vendre à Dakar Sénégal,47 000 000 FCFA,Almadies, media/annonces/pics/thumbs/5658c747c1ec3f37bb8b1835d8b2cd8c.jpeg 
Appartement à vendre,110 000 000 FCFA,Dakar, media/annonces/pics/thumbs/919917cddbc4f19cdbeefd5d196464a5.jpeg 
appartement à vendre,180 000 000 FCFA,Cité Keur Gorgui, media/annonces/pics/thumbs/6ec1c391ece94f3bbcb1afdc18b2d205.jpeg 
APPARTEMENT A VENDRE,105 021 000 FCFA,Ouest Foire, media/annonces/pics/thumbs/42c84336976605c6d5eef4ce0013f40b.jpeg 
APPARTEMENT F4 À VENDRE YOFF VIRAGE,135 000 000 FCFA,Virage, media/annonces/pics/thumbs/6f2f585d72d03992ccdf2076a618883d.jpeg 
bel appartement à vendre,110 000 000 FCFA,Dakar, media/annonces/pics/thumbs/0645790e9a5a34279a419a004eb2be05.jpeg 
F5 A VENDRE A OUEST FOIRE,165 000 000 FCFA,Ouest Foire, media/annonces/pics/thumbs/f189f0003242c5cf6e61a0cc8a7770d4.jpg 
F4 A VENDRE A FANN HOCK,122 000 000 FCFA,Fann, media/annonces/pics/thumbs/13ddbf1c7d5fdcd6954999fdd1988b19.jpg 
F4 A VENDRE AU PLATEAU,250 000 000 FCFA,Dakar, media/annonces/pics/thumbs/2ddedfb795b8b67a5309f225c5bfc3bf.jpg 
F4 A VENDRE AU VIRAGE,135 000 000 FCFA,Virage, media/annonces/pics/thumbs/91b75bdaa3b82c87f9a99bc2c718f1ca.jpg 
F2/F3 A VENDRE A LA MEDINA,55 000 000 FCFA,Médina, media/annonces/pics/thumbs/420e704a433247c21b84a3e2d346e5d1.jpg 
APPARTEMENT F2 A VENDRE AUX MAMELLES ALMADIES,58 800 000 FCFA,Almadies, media/annonces/pics/thumbs/9ff9428dc8d54c30fb99641c81a3b779.jpeg 
TRES JOLI APPARTEMENT À VENDRE,80 000 000 FCFA,Liberté 2, media/annonces/pics/thumbs/e93d635f1955c696d32b9cff3ba7cc26.jpg 
APPARTEMENT À VENDRE UNE BELLE OPPORTUNITÉ,110 000 000 FCFA,Sicap Foire, media/annonces/pics/thumbs/b4765fcdf142345c6e47eae0018f03d6.jpg 
Vente appartements au point e,250 000 000 FCFA,Point E, media/annonces/pics/thumbs/f6f093c4362473f2a057714740f38591.png 
APPARTEMENT F4 FOIRE CITY A VENDRE,135 400 000 FCFA,Sud Foire, media/annonces/pics/thumbs/39c4172cafdd74f3be58d82e1b14d47c.jpeg 
F2 A VENDRE SUR LA RESIDENCE FOIRE CITY,59 000 000 FCFA,Sud Foire, media/annonces/pics/thumbs/d586f7f694a2ae06f703dffdadb2b793.jpeg 
LA RÉSIDENCE FOIRE CITY,187 400 000 FCFA,Sud Foire, media/annonces/pics/thumbs/89cbc8bff9f0e2cb2b13fa96bbef3923.png 
VENTE APPARTEMENT F2 VIRAGE,132 000 000 FCFA,Virage, media/annonces/pics/thumbs/121bdb41c7797422a16a2c5050123d13.jpeg 
BEL F3 en bordure de route,138 700 000 FCFA,Sacré Coeur, media/annonces/pics/thumbs/9e652be80ae27bb093898e76b580d54c.jpg 
Vente d'appartements en VEFA à Dakar plateau,262 350 000 FCFA,Dakar, media/annonces/pics/thumbs/09def6dfd04c1f46579b3343e6d7e19a.jpeg 
Superbe F4 neuf en bordure,150 000 000 FCFA,Sacré Coeur, media/annonces/pics/thumbs/13e61c09227f46617b2bcdcd13889e2d.jpg 
Appartement F3 à Vendre,70 000 000 FCFA,Maristes, media/annonces/pics/thumbs/e1252a7743e366e2355cf7f09b5a40e2.jpeg 
Studio Mamelles neuf,60 000 000 FCFA,Almadies, media/annonces/pics/thumbs/efbec190b09bfacf4e562c8fd0d1978c.jpg 
F3 neuf en bordure de route,135 000 000 FCFA,Sacré Coeur, media/annonces/pics/thumbs/fec9abf26f20f944fd03c689ffcd5296.jpg 
APPARTEMENT EN VENTE,85 000 000 FCFA,Amitié, media/annonces/pics/thumbs/e88894a10d129a9e14308bd8be6fbbdb.jpeg 
F4 à vendre,250 000 000 FCFA,Mermoz, media/annonces/pics/thumbs/6f9edbc650c6880616f9706c3a06d112.jpg 
F4 à vendre,215 000 000 FCFA,Mermoz, media/annonces/pics/thumbs/bdad948e609d24558b3bead7645b68bf.jpg 
Des appartements a vendre centre ville haut plateaux,2 000 000 FCFA,Plateau, media/annonces/pics/thumbs/027747862e4897657f214b7e819ea34a.jpeg 
F3 haut standing à Vendre,115 000 000 FCFA,Liberté 6, media/annonces/pics/thumbs/f3e5f21faa363990ad895c6f94ad5d10.jpeg 
Duplex sur sacré cœur 2,70 000 000 FCFA,Sacré Coeur, media/annonces/pics/thumbs/c3c5fedbb8f2de03eba21c879c9fa28f.jpg 
Studio de haut Standing à Ngor-Almadies,67 000 000 FCFA,Almadies, media/annonces/pics/thumbs/064bd1bc88a7e52457bdaa97b20a125d.jpeg 
appartement à vendre,285 000 000 FCFA,Almadies, media/annonces/pics/thumbs/14f3cd25a0625fc2834523b4f4e6ca31.jpeg 
Bâtiment de 150 mètres carrés à démolir à Dakar Sénégal,110 000 000 FCFA,Grand Yoff, media/annonces/pics/thumbs/d7d52ca93b62664f08294d9024128bc4.jpg 
UN APPARTEMENT À VENDRE,45 000 000 FCFA,Sicap Foire, media/annonces/pics/thumbs/fad906d994434614ecb8d3420cc14803.jpg 
Studio neuf sacré cœur,69 000 000 FCFA,Sacré Coeur, media/annonces/pics/thumbs/1013e084799ebb4252ca3df5a4b0cdf1.jpg 
F3 neuf aux Mamelles,97 700 000 FCFA,Mamelles, media/annonces/pics/thumbs/ea0b6ef4a5a73e07c2a58ac424ae128d.jpg 
Studio neuf Sacré cœur 3,60 000 000 FCFA,Sacré Coeur, media/annonces/pics/thumbs/2284b009a7f2a82a8d263e124cc3e79d.jpg 
Bel appartement haut standing aux Almadies,90 400 000 FCFA,Almadies, media/annonces/pics/thumbs/ef520ac1bf1f2575a581461651f97f37.jpg 
Appartement à vendre Dakar Almadies,90 400 000 FCFA,Almadies, media/annonces/pics/thumbs/fa4bce8d2fd5dfbb1d5bfae056e0af2c.jpg 
